{
  "ident": "aaaaaaaaaaaaamztaaaaaaaaae",
  "revision": "00000000-0000-0000-4444-000000000001",
  "state": "active",
  "size": 1048576,
  "md5": "d41d8cd98f00b204e9800998ecf8427e",
  "sha1": "da39a3ee5e6b4b0d3255bfef95601890afd80709",
  "sha256": "e3b0c44298fc1c149afbf4c8996fb92427ae41e4649b934ca495991b7852b855",
  "mimetype": "application/pdf",
  "content_scope": "article",
  "release_ids": [
    "aaaaaaaaaaaaarceaaaaaaaaae"
  ],
  "urls": [
    {
      "url": "https://example.edu/~frau/prcding.pdf",
      "rel": "web"
    },
    {
      "url": "https://web.archive.org/web/20210101000000/https://example.edu/~frau/prcding.pdf",
      "rel": "webarchive"
    }
  ]
}
